{
  "arn": "arn:aws:service:us-east-1:123456789012:resource/example",
  "name": "Example Resource",
  "version": "example-value",
  "sources": "example-value",
  "robotSoftwareSuite": "example-value",
  "lastUpdatedAt": "example-value",
  "revisionId": "abc123",
  "tags": "example-value",
  "environment": "example-value"
}